{
  "schema_version": "1.0",
  "anomaly_id": "DB-0001",
  "status": "cited",
  "model": "fixture-generator (no LLM)",
  "generated_at": "2026-10-01T00:00:00Z",
  "citations": [
    {
      "id": "FIXTURE-A-p3-c1",
      "doc": "Synthetic Test Document A (fixture)",
      "doc_title_zh": "合成測試文件甲（測試資料）",
      "page": 3,
      "section": "Test section 1",
      "quote": "Synthetic placeholder text for interface testing only; not quoted from any real document.",
      "source_url": "https://example.invalid/fixture-document-a"
    },
    {
      "id": "FIXTURE-B-p11-c2",
      "doc": "Synthetic Test Document B (fixture)",
      "doc_title_zh": "合成測試文件乙（測試資料）",
      "page": 11,
      "section": "Test section 2",
      "quote": "Second synthetic placeholder passage used to check multi-citation layout.",
      "source_url": "https://example.invalid/fixture-document-b"
    }
  ],
  "human_review_required": false,
  "abstain_reason": null,
  "redaction_log": {
    "items_removed": 0,
    "types": []
  },
  "en": {
    "title": "Preliminary Observation: Possible Wetland Loss at Site A",
    "summary": "A 2.36 ha area within the Wetland Buffer Area (indicative zoning) shows a persistent transition from water-covered to dry or filled surface, first observed in March 2025 and present in 6 of the last 6 months.",
    "evidence": [
      "Affected area: 2.36 ha",
      "Radar backscatter rose +7.2 dB above the 2023-2024 baseline for the same month",
      "NDWI changed by -0.40 against the same-month baseline",
      "First detected 2025-03, persistent in 6 of 6 recent months"
    ],
    "statutory_basis": [
      {
        "claim": "Synthetic test claim used to check that statutory claims and their citations render correctly.",
        "citation_ids": [
          "FIXTURE-A-p3-c1",
          "FIXTURE-B-p11-c2"
        ]
      }
    ],
    "recommended_action": "Refer for site inspection and zoning confirmation by the relevant authority.",
    "limitations": "Satellite-derived indicator for screening purposes only. This is not a legal determination of unauthorised development. Findings require site verification by the relevant authority."
  },
  "zh_hant": {
    "title": "初步觀察：A 地點可能出現濕地損失",
    "summary": "一幅面積約 2.36 公頃、位於濕地緩衝區（指示性分區）的範圍，自 2025 年 3 月起持續由水體覆蓋轉為乾地或填土表面，並於最近 6 個月中的 6 個月出現。",
    "evidence": [
      "受影響面積：2.36 公頃",
      "雷達後向散射較 2023 至 2024 年同月基線上升 +7.2 dB",
      "NDWI 較同月基線變化 -0.40",
      "首次偵測於 2025-03，最近 6 個月中持續 6 個月"
    ],
    "statutory_basis": [
      {
        "claim": "合成測試陳述，用於檢查法定依據及其引用能否正確顯示。",
        "citation_ids": [
          "FIXTURE-A-p3-c1",
          "FIXTURE-B-p11-c2"
        ]
      }
    ],
    "recommended_action": "建議轉介主管部門進行實地視察及確認土地用途地帶。",
    "limitations": "本結果為衛星遙感篩查指標，僅供參考，並非對違例發展的法律認定。相關發現須由主管部門進行實地核實。"
  }
}
