{
  "schema_version": "1.0",
  "anomaly_id": "DB-0003",
  "status": "cited",
  "model": "gemini-3.8-flash",
  "generated_at": "2026-10-11T00:00:00Z",
  "en": {
    "title": "Preliminary Enforcement Brief: Anomaly DB-0003 (Wetland Buffer Area)",
    "summary": "Satellite remote sensing detected significant surface alteration within the Wetland Buffer Area (WBA) covering approximately 3.1 hectares starting on 2025-06-10. An observed radar backscatter increase of 7.5 dB combined with a -0.5 drop in NDWI indicates surface drying or filling, and potential structural deposition. Under Town Planning Board Guidelines, development or unauthorized site modification within the WBA requiring planning permission requires an ecological impact assessment.",
    "evidence": [
      "Anomaly ID DB-0003 detected on 2025-06-10.",
      "Affected spatial area measured at approximately 3.1 hectares in the WBA.",
      "Radar backscatter delta of +7.5 dB indicating increased surface roughness or physical structure.",
      "Normalized Difference Water Index (NDWI) delta of -0.5 indicating reduction of open water or moisture."
    ],
    "statutory_basis": [
      "Town Planning Board Guidelines No. 12C (TPB PG-No. 12C), Section 6.4: Intention of the Wetland Buffer Area to protect the ecological integrity of fish ponds and wetlands in the WCA.",
      "Town Planning Board Guidelines No. 12C, Section 6.5: Requirement of ecological impact assessment for development or redevelopment requiring planning permission within the WBA.",
      "Town Planning Board Guidelines No. 12C, Section 6.6: Restrictions on open storage or container back-up uses within the WBA."
    ],
    "recommended_action": "Conduct immediate on-site inspection to verify whether unauthorized filling, open storage, or construction is taking place, and cross-reference planning records to verify if valid planning permission or an approved ecological impact assessment exists for the site.",
    "limitations": "Remote sensing observations provide indicative physical surface changes only and cannot establish planning authorization status or specific commercial operational activity without physical ground inspection and official planning register checks."
  },
  "zh_hant": {
    "title": "初步執法簡報：異常個案 DB-0003（濕地緩衝區）",
    "summary": "衛星遙感監測於2025年6月10日在濕地緩衝區（WBA）內探測到顯著的地表變化，影響面積約3.1公頃。雷達後向散射增加7.5 dB且NDWI數值下降0.5，顯示存在水體減少、填土或構築物沉積跡象。根據城市規劃委員會指引，濕地緩衝區內需要規劃許可的發展或重建工程必須提交生態影響評估。",
    "evidence": [
      "異常個案 DB-0003 於 2025-06-10 首次偵測。",
      "位於濕地緩衝區（WBA），受影響面積約 3.1 公頃。",
      "雷達後向散射變化達 +7.5 dB，反映地表粗糙度或實體構築物增加。",
      "歸一化差值水體指數（NDWI）變化為 -0.5，顯示水體面積或濕潤度減少。"
    ],
    "statutory_basis": [
      "城市規劃委員會規劃指引編號 12C 第 6.4 條：濕地緩衝區的規劃意向是保護濕地保育區內魚塘和濕地的生態完整性。",
      "城市規劃委員會規劃指引編號 12C 第 6.5 條：濕地緩衝區內需要委員會規劃許可的發展或重建，必須提交生態影響評估。",
      "城市規劃委員會規劃指引編號 12C 第 6.6 條：濕地緩衝區內一般不容許設立新的露天貯物或貨櫃後勤用途。"
    ],
    "recommended_action": "進行實地視察以確認是否存在未經授權的填土、露天貯物或工程活動，並查核法定規劃紀錄以核實該地點是否已獲規劃許可或已提交經批准的生態影響評估。",
    "limitations": "遙感數據僅反映地表物理特徵之變化，在未進行實地調查及核對法定規劃紀錄前，無法確認其法定規劃許可狀況或具體商業作業性質。"
  },
  "citations": [
    {
      "chunk_id": "pg12c_e-p6",
      "document_title": "Town Planning Board Guidelines No. 12C",
      "page_number": 6,
      "verbatim_quote": "The intention of the WBA is to protect the ecological integrity of the fish ponds and wetland within the WCA and prevent development that would have a negative off-site disturbance impact on the ecological value of fish ponds."
    },
    {
      "chunk_id": "pg12c_e-p6",
      "document_title": "Town Planning Board Guidelines No. 12C",
      "page_number": 6,
      "verbatim_quote": "Within the WBA, for development or redevelopment which requires planning permission from the Board, an ecological impact assessment would also need to be submitted."
    },
    {
      "chunk_id": "pg12c_e-p6",
      "document_title": "Town Planning Board Guidelines No. 12C",
      "page_number": 6,
      "verbatim_quote": "Applications for new open storage or container back-up uses including workshops within the WBA, whether temporary or permanent, would normally not be allowed in view of the adverse disturbances of such activities on birds"
    }
  ],
  "human_review_required": true,
  "abstain_reason": null,
  "redaction_log": {
    "items_removed": 0,
    "types": []
  }
}